[
  {
    "project_code": "SL_PROJ_100",
    "title": "Media Title 1",
    "content_type": "SHORT_FORM",
    "genre": "THRILLER",
    "production_tier": "LOW_BUDGET",
    "production_status": "FILMING",
    "primary_language": "Marathi",
    "target_regions": [
      "US",
      "Singapore",
      "UK"
    ],
    "release_date": "2025-12-14",
    "estimated_total_budget": 4687330,
    "actual_spend_to_date": 2204551
  },
  {
    "project_code": "SL_PROJ_101",
    "title": "Media Title 2",
    "content_type": "SHORT_FORM",
    "genre": "ACTION",
    "production_tier": "MID_BUDGET",
    "production_status": "POST_PRODUCTION",
    "primary_language": "Telugu",
    "target_regions": [
      "Singapore"
    ],
    "release_date": "2025-11-26",
    "estimated_total_budget": 3472744,
    "actual_spend_to_date": 3079722
  },
  {
    "project_code": "SL_PROJ_102",
    "title": "Media Title 3",
    "content_type": "ORIGINAL_SERIES",
    "genre": "ACTION",
    "production_tier": "LOW_BUDGET",
    "production_status": "DEVELOPMENT",
    "primary_language": "Hindi",
    "target_regions": [
      "India",
      "UAE",
      "US"
    ],
    "release_date": "2025-11-30",
    "estimated_total_budget": 4594639,
    "actual_spend_to_date": 3555647
  },
  {
    "project_code": "SL_PROJ_103",
    "title": "Media Title 4",
    "content_type": "ORIGINAL_SERIES",
    "genre": "ACTION",
    "production_tier": "LOW_BUDGET",
    "production_status": "FILMING",
    "primary_language": "Telugu",
    "target_regions": [
      "US",
      "UK"
    ],
    "release_date": "2025-09-04",
    "estimated_total_budget": 3542437,
    "actual_spend_to_date": 2433340
  },
  {
    "project_code": "SL_PROJ_104",
    "title": "Media Title 5",
    "content_type": "DOCUMENTARY",
    "genre": "THRILLER",
    "production_tier": "TENTPOLE",
    "production_status": "RELEASED",
    "primary_language": "Marathi",
    "target_regions": [
      "UK",
      "US"
    ],
    "release_date": "2025-09-27",
    "estimated_total_budget": 977519,
    "actual_spend_to_date": 814789
  },
  {
    "project_code": "SL_PROJ_105",
    "title": "Media Title 6",
    "content_type": "SPORTS_EVENT",
    "genre": "DRAMA",
    "production_tier": "MID_BUDGET",
    "production_status": "DEVELOPMENT",
    "primary_language": "Tamil",
    "target_regions": [
      "UAE",
      "Singapore",
      "UK"
    ],
    "release_date": "2025-12-28",
    "estimated_total_budget": 4609019,
    "actual_spend_to_date": 2210497
  },
  {
    "project_code": "SL_PROJ_106",
    "title": "Media Title 7",
    "content_type": "ORIGINAL_SERIES",
    "genre": "ACTION",
    "production_tier": "MID_BUDGET",
    "production_status": "RELEASED",
    "primary_language": "English",
    "target_regions": [
      "India",
      "UAE",
      "Singapore"
    ],
    "release_date": "2026-01-22",
    "estimated_total_budget": 1608491,
    "actual_spend_to_date": 849536
  },
  {
    "project_code": "SL_PROJ_107",
    "title": "Media Title 8",
    "content_type": "ORIGINAL_SERIES",
    "genre": "CRICKET",
    "production_tier": "MID_BUDGET",
    "production_status": "DEVELOPMENT",
    "primary_language": "English",
    "target_regions": [
      "Singapore",
      "UK"
    ],
    "release_date": "2026-01-08",
    "estimated_total_budget": 4428137,
    "actual_spend_to_date": 2531123
  },
  {
    "project_code": "SL_PROJ_108",
    "title": "Media Title 9",
    "content_type": "SHORT_FORM",
    "genre": "CRICKET",
    "production_tier": "TENTPOLE",
    "production_status": "POST_PRODUCTION",
    "primary_language": "English",
    "target_regions": [
      "UAE",
      "US",
      "India"
    ],
    "release_date": "2026-03-13",
    "estimated_total_budget": 4089698,
    "actual_spend_to_date": 1871485
  },
  {
    "project_code": "SL_PROJ_109",
    "title": "Media Title 10",
    "content_type": "SHORT_FORM",
    "genre": "ACTION",
    "production_tier": "LOW_BUDGET",
    "production_status": "FILMING",
    "primary_language": "Marathi",
    "target_regions": [
      "US"
    ],
    "release_date": "2025-12-30",
    "estimated_total_budget": 945002,
    "actual_spend_to_date": 887791
  },
  {
    "project_code": "SL_PROJ_110",
    "title": "Media Title 11",
    "content_type": "ORIGINAL_SERIES",
    "genre": "THRILLER",
    "production_tier": "MID_BUDGET",
    "production_status": "FILMING",
    "primary_language": "Marathi",
    "target_regions": [
      "India",
      "US",
      "UAE"
    ],
    "release_date": "2025-09-03",
    "estimated_total_budget": 2733344,
    "actual_spend_to_date": 2521199
  },
  {
    "project_code": "SL_PROJ_111",
    "title": "Media Title 12",
    "content_type": "DOCUMENTARY",
    "genre": "DRAMA",
    "production_tier": "MID_BUDGET",
    "production_status": "POST_PRODUCTION",
    "primary_language": "Hindi",
    "target_regions": [
      "India"
    ],
    "release_date": "2025-10-20",
    "estimated_total_budget": 2604615,
    "actual_spend_to_date": 2005250
  },
  {
    "project_code": "SL_PROJ_112",
    "title": "Media Title 13",
    "content_type": "SHORT_FORM",
    "genre": "THRILLER",
    "production_tier": "TENTPOLE",
    "production_status": "POST_PRODUCTION",
    "primary_language": "Marathi",
    "target_regions": [
      "UK"
    ],
    "release_date": "2025-12-16",
    "estimated_total_budget": 3233411,
    "actual_spend_to_date": 2349722
  },
  {
    "project_code": "SL_PROJ_113",
    "title": "Media Title 14",
    "content_type": "ORIGINAL_SERIES",
    "genre": "REALITY",
    "production_tier": "LOW_BUDGET",
    "production_status": "PRE_PRODUCTION",
    "primary_language": "Marathi",
    "target_regions": [
      "India",
      "US"
    ],
    "release_date": "2025-08-28",
    "estimated_total_budget": 1796804,
    "actual_spend_to_date": 1529756
  },
  {
    "project_code": "SL_PROJ_114",
    "title": "Media Title 15",
    "content_type": "DOCUMENTARY",
    "genre": "COMEDY",
    "production_tier": "MID_BUDGET",
    "production_status": "POST_PRODUCTION",
    "primary_language": "Marathi",
    "target_regions": [
      "UAE",
      "Singapore",
      "India"
    ],
    "release_date": "2025-11-28",
    "estimated_total_budget": 2862603,
    "actual_spend_to_date": 1599040
  },
  {
    "project_code": "SL_PROJ_115",
    "title": "Media Title 16",
    "content_type": "DOCUMENTARY",
    "genre": "DRAMA",
    "production_tier": "TENTPOLE",
    "production_status": "PRE_PRODUCTION",
    "primary_language": "Telugu",
    "target_regions": [
      "UK"
    ],
    "release_date": "2025-10-07",
    "estimated_total_budget": 1346395,
    "actual_spend_to_date": 1418920
  },
  {
    "project_code": "SL_PROJ_116",
    "title": "Media Title 17",
    "content_type": "SPORTS_EVENT",
    "genre": "ACTION",
    "production_tier": "TENTPOLE",
    "production_status": "PRE_PRODUCTION",
    "primary_language": "Tamil",
    "target_regions": [
      "India"
    ],
    "release_date": "2026-03-02",
    "estimated_total_budget": 1814479,
    "actual_spend_to_date": 1539955
  },
  {
    "project_code": "SL_PROJ_117",
    "title": "Media Title 18",
    "content_type": "DOCUMENTARY",
    "genre": "CRICKET",
    "production_tier": "MID_BUDGET",
    "production_status": "RELEASED",
    "primary_language": "Tamil",
    "target_regions": [
      "US",
      "Singapore",
      "UAE"
    ],
    "release_date": "2026-01-03",
    "estimated_total_budget": 1731501,
    "actual_spend_to_date": 1819362
  },
  {
    "project_code": "SL_PROJ_118",
    "title": "Media Title 19",
    "content_type": "SHORT_FORM",
    "genre": "CRICKET",
    "production_tier": "TENTPOLE",
    "production_status": "DEVELOPMENT",
    "primary_language": "Tamil",
    "target_regions": [
      "US",
      "Singapore"
    ],
    "release_date": "2026-03-01",
    "estimated_total_budget": 3203099,
    "actual_spend_to_date": 2725249
  },
  {
    "project_code": "SL_PROJ_119",
    "title": "Media Title 20",
    "content_type": "SHORT_FORM",
    "genre": "COMEDY",
    "production_tier": "TENTPOLE",
    "production_status": "FILMING",
    "primary_language": "Marathi",
    "target_regions": [
      "US",
      "UK",
      "UAE"
    ],
    "release_date": "2026-03-07",
    "estimated_total_budget": 1263479,
    "actual_spend_to_date": 1066303
  },
  {
    "project_code": "SL_PROJ_120",
    "title": "Media Title 21",
    "content_type": "LICENSED_MOVIE",
    "genre": "THRILLER",
    "production_tier": "TENTPOLE",
    "production_status": "PRE_PRODUCTION",
    "primary_language": "Marathi",
    "target_regions": [
      "US"
    ],
    "release_date": "2025-10-25",
    "estimated_total_budget": 2424631,
    "actual_spend_to_date": 1100615
  },
  {
    "project_code": "SL_PROJ_121",
    "title": "Media Title 22",
    "content_type": "SPORTS_EVENT",
    "genre": "REALITY",
    "production_tier": "LOW_BUDGET",
    "production_status": "RELEASED",
    "primary_language": "Hindi",
    "target_regions": [
      "India"
    ],
    "release_date": "2025-08-21",
    "estimated_total_budget": 2204180,
    "actual_spend_to_date": 1891335
  },
  {
    "project_code": "SL_PROJ_122",
    "title": "Media Title 23",
    "content_type": "SHORT_FORM",
    "genre": "DRAMA",
    "production_tier": "LOW_BUDGET",
    "production_status": "FILMING",
    "primary_language": "Telugu",
    "target_regions": [
      "UK",
      "India",
      "UAE"
    ],
    "release_date": "2026-03-05",
    "estimated_total_budget": 1648940,
    "actual_spend_to_date": 780543
  },
  {
    "project_code": "SL_PROJ_123",
    "title": "Media Title 24",
    "content_type": "SHORT_FORM",
    "genre": "THRILLER",
    "production_tier": "MID_BUDGET",
    "production_status": "DEVELOPMENT",
    "primary_language": "English",
    "target_regions": [
      "Singapore",
      "UK",
      "UAE"
    ],
    "release_date": "2026-03-09",
    "estimated_total_budget": 899114,
    "actual_spend_to_date": 1057074
  },
  {
    "project_code": "SL_PROJ_124",
    "title": "Media Title 25",